{
  "id": "malwarebytes-support-tool",
  "vendor": "Malwarebytes",
  "tool_name": "Malwarebytes Support Tool (MBST)",
  "official_docs_url": "https://support.malwarebytes.com/hc/en-us/articles/360039023473-Uninstall-and-reinstall-Malwarebytes-using-the-Malwarebytes-Support-Tool",
  "tier": "both",
  "supported_products": [
    "Malwarebytes Free",
    "Malwarebytes Premium",
    "Malwarebytes Plus",
    "Malwarebytes Endpoint Protection"
  ],
  "download_url": "https://downloads.malwarebytes.com/file/mbst",
  "file_type": "exe",
  "expected_sha256": null,
  "execution": {
    "requires_safe_mode": false,
    "requires_reboot": true,
    "silent_flags": "/y /cleanup /noreboot",
    "force_flags": "/y /cleanup",
    "cli_only": false
  },
  "notes": "Use the Clean option under Advanced in GUI mode; for headless automation fetch mbstcmd.exe via https://downloads.malwarebytes.com/file/mbst-cmd with /y /cleanup /noreboot."
}
